{
  "schemaVersion": "1.1",
  "asOf": "2026-08-03",
  "protocol": {
    "protocolVersion": "1.0",
    "acceptanceRuleEn": "A country-year enters the public donor count only when D1–D10 all pass with source-linked evidence. Failed, open or structurally invalid records remain outside the count.",
    "acceptanceRuleFi": "Maa–vuosi lasketaan julkiseksi luovuttajamarkkinaksi vain, kun D1–D10 läpäisevät lähteistetyn tarkistuksen. Hylätty, avoin tai rakenteellisesti virheellinen tietue jää lukumäärän ulkopuolelle.",
    "criteria": [
      {
        "criterionId": "D1",
        "titleEn": "Complete calendar year",
        "titleFi": "Kokonainen kalenterivuosi",
        "requirementEn": "The figure covers one complete, identified calendar year.",
        "requirementFi": "Luku kattaa yhden kokonaisen ja yksilöidyn kalenterivuoden."
      },
      {
        "criterionId": "D2",
        "titleEn": "Consumer retail transaction",
        "titleFi": "Kuluttajavähittäiskaupan tapahtuma",
        "requirementEn": "The transaction level is consumer retail sell-through, not a supply-stage proxy.",
        "requirementFi": "Tapahtumataso on kuluttajavähittäismyynti eikä toimitusketjun korvikemittari."
      },
      {
        "criterionId": "D3",
        "titleEn": "Devices and consumables",
        "titleFi": "Laitteet ja kulutustarvikkeet",
        "requirementEn": "Devices and consumables are both covered, or their split is explicitly reconciled.",
        "requirementFi": "Sekä laitteet että kulutustarvikkeet sisältyvät lukuun tai niiden jako on täsmäytetty."
      },
      {
        "criterionId": "D4",
        "titleEn": "Adjacent products controlled",
        "titleFi": "Viereiset tuoteryhmät hallittu",
        "requirementEn": "Heated tobacco, herbal smoking, smokeless tobacco and other adjacent products are excluded or separately quantified.",
        "requirementFi": "Kuumennettava tupakka, yrttipolttotuotteet, savuton tupakka ja muut viereiset tuoteryhmät on rajattu pois tai määrällistetty erikseen."
      },
      {
        "criterionId": "D5",
        "titleEn": "National channel coverage",
        "titleFi": "Valtakunnallinen kanavapeitto",
        "requirementEn": "Nationwide channels are covered, or every material channel gap is quantified.",
        "requirementFi": "Valtakunnalliset myyntikanavat on katettu tai jokainen olennainen kanavavaje on määrällistetty."
      },
      {
        "criterionId": "D6",
        "titleEn": "No supply-stage double counting",
        "titleFi": "Ei toimitusketjun kaksoislaskentaa",
        "requirementEn": "Manufacturer, importer, wholesaler and retailer stages are de-duplicated.",
        "requirementFi": "Valmistaja-, maahantuoja-, tukku- ja vähittäiskauppatasot on deduplikoitu."
      },
      {
        "criterionId": "D7",
        "titleEn": "Method and missingness documented",
        "titleFi": "Menetelmä ja puuttuvuus dokumentoitu",
        "requirementEn": "Method, missingness, revisions and data-quality warnings are documented.",
        "requirementFi": "Menetelmä, puuttuvuus, korjaukset ja aineiston laatuvaroitukset on dokumentoitu."
      },
      {
        "criterionId": "D8",
        "titleEn": "Currency and tax basis",
        "titleFi": "Valuutta- ja veroperusta",
        "requirementEn": "Currency and the treatment of VAT, GST and excise are explicit.",
        "requirementFi": "Valuutta sekä arvonlisä-, kulutus- ja valmisteverojen käsittely on yksiselitteinen."
      },
      {
        "criterionId": "D9",
        "titleEn": "Public reproducibility",
        "titleFi": "Julkinen toistettavuus",
        "requirementEn": "A public aggregate and reproducible source chain are available without private or unlicensed raw records.",
        "requirementFi": "Julkinen koontiluku ja toistettava lähdeketju ovat saatavilla ilman yksityisiä tai lisensoimattomia raakarekistereitä."
      },
      {
        "criterionId": "D10",
        "titleEn": "Independent reconciliation",
        "titleFi": "Riippumaton täsmäytys",
        "requirementEn": "The value is reconciled against an independent route or direct official validation.",
        "requirementFi": "Luku on täsmäytetty riippumattomaan laskentareittiin tai suoraan viranomaisvalidointiin."
      }
    ]
  },
  "gate": {
    "minimumAcceptedDonors": 3,
    "coverageGateRequired": true,
    "coverageGateStatus": "not_met",
    "coverageRuleEn": "Accepted donors must also provide documented regional and regulatory-archetype coverage before a public global total can be calculated.",
    "coverageRuleFi": "Hyväksyttyjen luovuttajamarkkinoiden on lisäksi muodostettava dokumentoitu alueellinen ja sääntelyarkkityyppien peitto ennen julkisen maailman kokonaisluvun laskemista."
  },
  "candidates": [
    {
      "candidateId": "NZ-2024-IDENTIFIED-VAPING-RETAIL-SUBTOTAL",
      "candidateType": "country_year",
      "countryIso2": "NZ",
      "geography": "New Zealand",
      "year": 2024,
      "referenceType": "observation",
      "referenceId": "NZ-2024-IDENTIFIED-VAPING-PRODUCT-SALES-RAW-SUM",
      "evidenceLaneId": "public_reproducible",
      "declaredDecision": "not_accepted",
      "headlineEn": "Reproduced specialist-retailer identified-vaping subtotal",
      "headlineFi": "Toistettu erikoisvähittäiskaupan tunnistettu sähkötupakkasumma",
      "criterionStatuses": [
        {"criterionId": "D1", "status": "passed"},
        {"criterionId": "D2", "status": "passed"},
        {"criterionId": "D3", "status": "passed"},
        {"criterionId": "D4", "status": "passed"},
        {"criterionId": "D5", "status": "failed"},
        {"criterionId": "D6", "status": "passed"},
        {"criterionId": "D7", "status": "passed"},
        {"criterionId": "D8", "status": "open"},
        {"criterionId": "D9", "status": "passed"},
        {"criterionId": "D10", "status": "open"}
      ],
      "blockerEn": "The NZD 274,180,410.21 subtotal is vaping-only and supply-stage controlled, but it remains incomplete specialist retail. Official forms require general retailers to report quantities but not retail prices or sales value, so D5 is structurally failed; GST treatment remains unstated, so D8 is open. The NZD 183,370,681 and NZD 197,070,322 border proxies are different-stage diagnostics. The 0.11% CPI weight is based mainly on the HES year ended June 2023 and price-updated to December 2024, so it is not an independent calendar-2024 sales reconciliation. D10 remains open.",
      "blockerFi": "274 180 410,21 NZD:n summa on sähkötupakkarajattu ja toimitusketjutaso hallittu, mutta se on yhä puutteellinen erikoisvähittäiskaupan luku. Viralliset lomakkeet vaativat yleiskauppiailta määrät mutta eivät vähittäishintoja tai myyntiarvoa, joten D5 on rakenteellisesti hylätty; GST-käsittely pysyy ilmoittamatta, joten D8 on avoin. 183 370 681 ja 197 070 322 NZD:n rajaproxyt ovat eri tapahtumavaiheen diagnostiikkaa. 0,11 prosentin CPI-paino perustuu pääosin kesäkuuhun 2023 päättyneeseen HES-jaksoon ja on hinta-ajantasaistettu joulukuuhun 2024, joten se ei ole riippumaton kalenterivuoden 2024 myyntitäsmäytys. D10 pysyy avoinna.",
      "nextEvidenceEn": "Obtain an observed national general-retail value and return-completeness denominator, confirm the GST basis, and reconcile the same 2024 boundary against an independent route.",
      "nextEvidenceFi": "Hanki havaittu valtakunnallinen yleisvähittäiskaupan arvo ja ilmoitusten peiton nimittäjä, vahvista GST-perusta ja täsmäytä sama vuoden 2024 rajaus riippumattomaan reittiin.",
      "acquisitionRouteEn": "New Zealand Ministry of Health coverage and GST clarification, followed by a non-duplicative tax, customs, POS or direct official reconciliation.",
      "acquisitionRouteFi": "Uuden-Seelannin terveysministeriön peitto- ja GST-täsmennys, minkä jälkeen riippumaton vero-, tulli-, POS- tai suora viranomaistäsmäytys.",
      "responseStatus": "public_source_available",
      "licenseStatus": "public_source_link_only",
      "lastReviewedAt": "2026-08-02",
      "sourceIds": [
        "NZ-MOH-ANNUAL-RETURNS-2024",
        "NZ-MOH-ANNUAL-RETURN-REQUIREMENTS",
        "NZ-MOH-ANNUAL-RETURNS-2024-GUIDE",
        "NZ-STATSNZ-CPI-WEIGHTS-2024"
      ],
      "closureActions": [
        {
          "actionId": "NZ-CHANNEL-TAX-20260724",
          "criterionIds": ["D5"],
          "ownerRole": "public_authority",
          "routeType": "official_aggregate_request",
          "routeEn": "Use the prepared 7 August follow-up to seek any held observed RPS value plus required, received, nil, late, rejected, usable and published return counts and the legal-entity or outlet denominator.",
          "routeFi": "Käytä valmisteltua 7.8. seurantaa mahdollisen hallussa olevan havaitun RPS-arvon sekä vaadittujen, saatujen, nil-, myöhästyneiden, hylättyjen, käyttökelpoisten ja julkaistujen ilmoitusten ja oikeushenkilö- tai myymälänimittäjän pyytämiseen.",
          "evidenceTargetEn": "Observed nationwide general-retail value or quantitatively bounded material channel gaps, with a documented coverage denominator and no company-identifiable records.",
          "evidenceTargetFi": "Havaittu valtakunnallinen yleisvähittäiskaupan arvo tai määrällisesti rajatut olennaiset kanava-aukot sekä dokumentoitu peittonimittäjä ilman yritysten tunnistavia tietueita.",
          "publicStatus": "request_sent",
          "statusAsOf": "2026-07-24",
          "nextFollowUpOn": "2026-08-07"
        },
        {
          "actionId": "NZ-GST-BASIS-20260726",
          "criterionIds": ["D8"],
          "ownerRole": "public_authority",
          "routeType": "official_aggregate_request",
          "routeEn": "Use the prepared 7 August follow-up to confirm NZD, GST, actual revenue versus RRP-times-quantity and the treatment of discounts, refunds, returns, credits, timing and corrections.",